{
  "$schema": "./ecosystem.schema.json",
  "repository": "masinlocandher-max/FMB-Ecosystem",
  "policy": {
    "sourceControl": "This monorepo is authoritative only for applications listed in applications. SENZ is external at masinlocandher-max/Senz; apps/senz is historical. FMB News is external at masinlocandher-max/FMBNews.",
    "deployment": "One independently configured Vercel project per active application boundary listed in applications. SENZ is excluded and publishes independently from masinlocandher-max/Senz. FMB News is excluded and deploys independently through Cloudflare from masinlocandher-max/FMBNews.",
    "data": "No production database, authentication tenant, service-role key, or private environment variable may be shared across FMB/Yoni, SENZ, and Cognita unless explicitly approved and documented."
  },
  "applications": {
    "fmb": {
      "workspace": "apps/withlovefmb",
      "package": "@fmb/withlovefmb",
      "vercelProject": "fmb-public-and-yoni",
      "domains": [
        "www.francinemariebautista.com",
        "francinemariebautista.com",
        "yoni.francinemariebautista.com",
        "app.francinemariebautista.com"
      ],
      "dataBoundary": "fmb-public-member",
      "owns": [
        "FMB public website",
        "With love, FMB",
        "Yoni",
        "FMB Music",
        "FMB eBooks",
        "Mabayani public pages"
      ]
    },
    "cognita": {
      "workspace": "apps/cognita",
      "package": "base44-app",
      "vercelProject": "cognita",
      "domains": [
        "www.thecognitainstitute.com",
        "thecognitainstitute.com"
      ],
      "dataBoundary": "cognita-learning",
      "owns": [
        "Cognita public website",
        "Cognita learning application",
        "Cognita learner and institutional systems"
      ]
    }
  },
  "externalApplications": {
    "senz": {
      "repository": "masinlocandher-max/Senz",
      "productionBranch": "main",
      "sourceRoot": ".",
      "domains": ["www.senzpr.com", "senzpr.com"],
      "publisher": "github-pages",
      "legacyWorkspace": "apps/senz"
    }
  }
}
